{
  "name": "autorepeat",
  "display_name": "自动复读",
  "description": "当群组中多名用户在指定时间内发送相同内容时自动复读",
  "author": "TelePilot Official",
  "version": "1.0.0",
  "entry": "plugin.py",
  "category": "automation",
  "permissions": ["send_message", "edit_message", "read_chat", "resolve_entity"],
  "config_schema": {
    "type": "object",
    "x-ui-mode": "rules",
    "x-usage-guide": "自动复读通过规则触发：每条规则绑定一个群组和复读条件。当指定时间窗口内有足够多不同用户发送完全相同文本时，账号会自动复读一次。规则只监听 incoming 文本消息，保存后立即生效。",
    "additionalProperties": false,
    "required": ["target_chat_id"],
    "properties": {
      "target_chat_id": {
        "type": "integer",
        "title": "群组 ID",
        "description": "监控的群组 chat_id（Telethon marked ID 格式）"
      },
      "time_window": {
        "type": "integer",
        "title": "时间窗口（秒）",
        "default": 300,
        "description": "统计相同消息的时间窗口，默认 300（5分钟）"
      },
      "min_users": {
        "type": "integer",
        "title": "最少触发人数",
        "default": 5,
        "description": "触发复读所需的不同用户数，默认 5"
      }
    }
  },
  "tags": ["official", "recommended", "automation"]
}
