{
  "name": "auto_reply",
  "display_name": "自动回复",
  "description": "按规则匹配关键词或正则后自动回复目标会话",
  "author": "TelePilot Official",
  "version": "0.1.0",
  "entry": "plugin.py",
  "category": "automation",
  "permissions": ["send_message", "edit_message", "read_chat"],
  "config_schema": {
    "type": "object",
    "x-ui-mode": "rules",
    "x-usage-guide": "自动回复通过规则触发：每条规则配置匹配范围、关键词或正则、回复模板和冷却限制。安装后到插件中心选择账号，再进入自动回复配置页新增规则。规则保存后会随账号 worker 热更新生效。",
    "additionalProperties": false,
    "properties": {}
  },
  "tags": ["official", "recommended", "automation"]
}
